Over #,Ball #,Bowler_Name+Cricinfo_Link,Batsman_Name+Cricinfo_Link,Outcome,Total Runs ,Comment_CricInfo,Comment_CricBuzz,Delivery Length,Delivery Line,Bowling Side,Delivery Speed,Delivery Type,Shot Type ,Shot Field Position,Hit Type,Ball Type,Out_type,Umpire Actions,Field Activity 1 ,Field Activity 2 ,Field Activity 3 ,Other Actions 1,Other Actions 2
1,1,Saqib Mahmood,Babar Azam (c),Dot,0,"Hard length in the channel, Azam steps out and punches to extra cover"," straightaway pitches it up outside off, Azam brings out an elegant drive but finds extra cover",Hard Length,Outside Off,Unknown,Unknown,Normal,Punches,Short Cover,Middled,Legal,Not Out,Normal ,Normal Fielding,Normal Fielding,Normal Fielding,Nothing,Nothing
1,2,Saqib Mahmood,Babar Azam (c),Dot,0,"Banged into the surface at 87mph/139kph and this is angled towards backward point with an open face

","140kph, shortens his length and keeps it just outside off, Azam jumps back and drops it with soft hands towards point",Short (>9 m),Outside Off,Unknown,140,Normal,Pull,Backward Point,Middled,Legal,Not Out,Normal ,Normal Fielding,Normal Fielding,Normal Fielding,Nothing,Nothing
1,3,Saqib Mahmood,Babar Azam (c),Single,1,"Short and at the body, 82mph/132kph and worked through square off the back foot",short-arm jabs this back of a length delivery aimed at his hips through square leg and gets off the mark,Length (6-9 m),At Body,Unknown,132,Normal,Flick,Square ,Middled,Legal,Not Out,Normal ,Normal Fielding,Normal Fielding,Normal Fielding,Nothing,Nothing
1,4,Saqib Mahmood,Fakhar Zaman ,Dot,0,"Back of a length, Zaman plays away from his body and chops an inside edge past his stumps, short fine leg cuts it off","shortish and angles it away from Zaman, who without any feet movement gropes at it and gets a thick inside edge which bobbles past the stumps en route to short fine leg",Short (>9 m),Angles Away,Unknown,Unknown,Normal,Pull,Fine Leg,Thick Inside Edge,Legal,Not Out,Normal ,Normal Fielding,Normal Fielding,Normal Fielding,Nothing,Nothing
1,5,Saqib Mahmood,Fakhar Zaman ,Single,1,"Leading edge, just out of reach in Mahmood's follow-through! Touch fuller, nibbling as Zaman closes the face, squirts it back past the non-striker's stumps for a single","""Catch"" is the shout but it's out of Mahmood's grasp. Fuller length and straightens a touch, enticed Zaman to flick it across the line through mid-wicket. Leading edge pops up in the air and falls to the right of the bowler. Lucky escape there for Zaman",Full length(5-6 m),Down the leg side,Unknown,Unknown,Normal,Flick,Bowler,Leading Edge,Legal,Not Out,Normal ,In the air,Normal Fielding,Normal Fielding,Nothing,Nothing
1,6,Saqib Mahmood,Babar Azam (c),Dot,0,"Short, cramps him with the ball coming in, short-armed to mid-on - tidy opening over from Mahmood"," shortish, Azam stands tall and knocks it to mid-on",Short (>9 m),Coming In,Unknown,Unknown,Normal,On drive,Mid On,Middled,Legal,Not Out,Normal ,Normal Fielding,Normal Fielding,Normal Fielding,Nothing,Nothing
2,1,Moeen Ali ,Fakhar Zaman ,Out,0,"Bowled 'im through the gate! Moeen finds his line from round the wicket straight away, and he topples Zaman with his first ball! Nicely flighted but this didn't turn, as the batsman was expecting, simply scuttled on with the arm and into the top of middle stump. Good night!","Cleaned up. Moeen Ali strikes gold off his first ball as England have an early wicket. Fakhar Zaman looked very edgy in the two balls he faced today and now, totally misreads an arm-ball from the offie here. Slanted in from round the wicket, Zaman was stuck in his crease, didn't anticipate it at all, left a huge gap between his bat and ball. Enough for it to sneak through the gate and crash the stumps. Horrible start for Pakistan. ",Good length(6-8 m),Middle Stumps,Around the Wicket,Unknown,Arm Ball,Miss,Wicket Keeper,Miss,Legal,Bowled,Normal ,Normal Fielding,Normal Fielding,Normal Fielding,Bowlers Celebration,Nothing
2,2,Moeen Ali ,Haider Ali ,Single,1,"Over the wicket, tossed up and clipped through mid-on for his first international run",worked away to long-on. The youngster is away with a single,Good length(6-8 m),Unknown,Over the Wicket,Unknown,Normal,Clipped,Mid On,Middled,Legal,Not Out,Normal ,Normal Fielding,Normal Fielding,Normal Fielding,Nothing,Nothing
2,3,Moeen Ali ,Babar Azam (c),Single,1,Darted on the stumps and Azam nudges another back down the ground,"spinning back in, Azam gets behind it and wrists it to long-on",Good length(6-8 m),On the stumps,Unknown,Unknown,Normal,On drive,Long On,Middled,Legal,Not Out,Normal ,Normal Fielding,Normal Fielding,Normal Fielding,Nothing,Nothing
2,4,Moeen Ali ,Haider Ali ,Six,6,"Haider goes boom! Second ball launched over wide long-on! He has absolutely melted that, down on one knee and slogging aggressively through the line","oh, wow. A fearless hit from the 19-year old. Sits down on his knees, imparts some power in his attempted swipe down the ground and launches it furiously over long-on. First six in T20I cricket, amazing shot from Haider Ali!",Good length(6-8 m),On middle stump,Unknown,Unknown,Normal,Sweep,Long On,Middled,Legal,Not Out,Normal ,Normal Fielding,Normal Fielding,Normal Fielding,Nothing,Nothing
2,5,Moeen Ali ,Haider Ali ,Single,1,Pushed through and tucked off the pads,now sensibly eases this off-break to long-on all along the ground,Good length(6-8 m),Off Side,Unknown,Unknown,Off Break,Push,Long On,Middled,Legal,Not Out,Normal ,Normal Fielding,Normal Fielding,Normal Fielding,Nothing,Nothing
2,6,Moeen Ali ,Babar Azam (c),Single,1,"Floated up outside off, Azam opens the face on a drive in front of square",punched through cover,Good length(6-8 m),Outside Off,Unknown,Unknown,Normal,On drive,Cover,Middled,Legal,Not Out,Normal ,Normal Fielding,Normal Fielding,Normal Fielding,Nothing,Nothing
3,1,Saqib Mahmood,Babar Azam (c),Single,1,Length in the channel and steered down to third man,"short outside off, Azam laces the cut away to third man",Short (>9 m),Outside Off,Unknown,Unknown,Normal,Pull,Third Man,Middled,Legal,Not Out,Normal ,Normal Fielding,Normal Fielding,Normal Fielding,Nothing,Nothing
3,2,Saqib Mahmood,Haider Ali ,Single,1,Angled in and worked off the body behind square,"straighter line from Mahmood, Haider Ali twirls his wrists and clips it to deep square leg",Length (6-9 m),Straighter,Unknown,Unknown,Angled In,Clipped,Deep Square leg,Middled,Legal,Not Out,Normal ,Normal Fielding,Normal Fielding,Normal Fielding,Nothing,Nothing
3,3,Saqib Mahmood,Babar Azam (c),Four,4,"Creamed down the ground! Imperious from Azam, stroking this on the up back through mid-off and away","Azam gets into the act. Opens his stance in order to create room, spots a length delivery and drills it powerfully past mid-off",Length (6-9 m),Unknown,Unknown,Unknown,Normal,Cover Drive,Mid Off,Middled,Legal,Not Out,Normal ,Normal Fielding,Normal Fielding,Normal Fielding,Nothing,Nothing
3,4,Saqib Mahmood,Babar Azam (c),Four,4,"Carted through midwicket, back-to-back fours for the captain! Dug in by Mahmood but the ball sits up nicely and he swings it away through the infield","consecutive fours for Pakistan's captain. This wasn't all that short, but Azam went very deep in his crease and pulled it across the line. Didn't get it off the middle but it beats mid-wicket and this outfield is very quick. Races away to the boundary",Short (>9 m),Down the leg side,Unknown,Unknown,Normal,Pull,Mid Wicket,Thin Edge,Legal,Not Out,Normal ,Normal Fielding,Normal Fielding,Normal Fielding,Nothing,Nothing
3,5,Saqib Mahmood,Babar Azam (c),Four,4,"Filleted to third man! Three in a row for Babar, sits back and angles the face on a cross-seamer, gets the ball fine, third man is back but can't get across to cut it off","one more! Now some dexterity from Azam. Knew Mahmood would hurl it outside off, waited for it and opened his bat face at the right time. Then guided it very fine to the right of the keeper, no chance for the fielder at third man. Pure class!",Length (6-9 m),Outside Off,Unknown,Unknown,Normal,Cut,Third Man,Middled,Legal,Not Out,Normal ,Normal Fielding,Normal Fielding,Normal Fielding,Nothing,Nothing
3,6,Saqib Mahmood,Babar Azam (c),Single,1,"Short of a length, this time Azam stays back and glides one to third man","similar delivery and Azam plays a similar shot, this time he places it straight to third man",Short (>9 m),Outside Off,Unknown,Unknown,Normal,Cut,Third Man,Middled,Legal,Not Out,Normal ,Normal Fielding,Normal Fielding,Normal Fielding,Nothing,Nothing
4,1,Chris Jordan ,Babar Azam (c),Dot,0,"Full on off, 82mph/132kph and spanked on the drive, Jordan grabs it in his follow through","fullish on off, Azam drives it sweetly back to the bowler. Jordan collects and threatens to throw it back but Azam is unfazed..",Full length(5-6 m),On Off,Unknown,132,Normal,Straight drive,Bowler,Middled,Legal,Not Out,Normal ,Normal Fielding,Normal Fielding,Normal Fielding,Nothing,Nothing
4,2,Chris Jordan ,Babar Azam (c),Dot,0,"Tight line outside off, Azam again looks for the angled bat glide and chops it down into the turf"," short of a length just outside off, Azam tries to dink it to third man but got cramped for space a little. Ends up chopping it to the keeper",Short (>9 m),Outside Off,Unknown,Unknown,Normal,On drive,Third Man,Middled,Legal,Not Out,Normal ,Normal Fielding,Normal Fielding,Normal Fielding,Nothing,Nothing
4,3,Chris Jordan ,Babar Azam (c),Double,2,"86mph/138kph and steered through backward point, good running brings them two on the throw"," slices it behind point, puts on the skates and comes back for the second. Wayward throw from the fielder but good backing up from England ensures there's no overthrows",Unknown,Unknown,Unknown,138,Normal,Pull,Backward Point,Middled,Legal,Not Out,Normal ,Miss Field,Normal Fielding,Normal Fielding,Nothing,Nothing
4,4,Chris Jordan ,Babar Azam (c),Single,1,"Length, 83mph/134kph and sliding into the pads, Azam tucks through backward square","swerving back in, tucked to square leg",Length (6-9 m),Into the Pads,Unknown,134,Normal,Tuck,Backward Square,Middled,Legal,Not Out,Normal ,Normal Fielding,Normal Fielding,Normal Fielding,Nothing,Nothing
4,5,Chris Jordan ,Haider Ali ,Leg Bye Single,1,"Short and in at the hip, Haider swings across the line, deflects towards third man off the body","pacy short delivery, Haider Ali went for the pull but it was too quick for him. Struck on the thigh and it runs away to third man",Short (>9 m),At the Hip,Unknown,Unknown,Normal,Swings,Third Man,Middled,Legal,Not Out,Normal ,Normal Fielding,Normal Fielding,Normal Fielding,Nothing,Nothing
4,6,Chris Jordan ,Babar Azam (c),Single,1,"Shortish length and worked away through the leg side, just a single, decent start from Jordan","rolls his fingers across this back of a length delivery on middle and leg, whipped to the left of deep mid-wicket. They will settle for a single",Short (>9 m),On Middle and Leg,Unknown,Unknown,Normal,Whipped,Deep Mid Wicket,Middled,Legal,Not Out,Normal ,Normal Fielding,Normal Fielding,Normal Fielding,Nothing,Nothing
5,1,Tom Curran ,Babar Azam (c),Dot,0,"Full and fast, up in the blockhole and Azam can only bunt to mid-on","Curran starts off with a yorker at 132kph on off, Azam jams his drive to mid-on",Full length(5-6 m),BlackHole,Unknown,Unknown,Normal,Bunt,Mid On,Middled,Legal,Not Out,Normal ,Normal Fielding,Normal Fielding,Normal Fielding,Nothing,Nothing
5,2,Tom Curran ,Babar Azam (c),Out,0,"Castled! Curran goes straight through Pakistan's captain and talisman! Perfect length, Azam a little flat-footed as he aimed a wafty drive, and the ball hit the seam before coming back and properly jiggering his stumps! *Powerplay wicket klaxon* England have a second for the night"," Curran messes up the stumps and it's a body blow to Pakistan. Their captain and the best batter in the team has to depart. What a bowling change from Morgan which has worked like a charm for England. Goodish length with a hint of little inward zip after pitching. Babar Azam exposed his stumps hoping to punch it on the off-side, got done in by the nip-backer as he misses it and sees the debris behind. Both openers dismissed in a similar fashion. Look at Curran, he's all elated. ",Length (6-9 m),In the stumps,Unknown,Unknown,Normal,Miss,Wicket,Miss,Legal,Bowled,Normal ,Normal Fielding,Normal Fielding,Normal Fielding,Nothing,Nothing
5,3,Tom Curran ,Mohammad Hafeez ,Dot,0,"Pitched up, skidding on to the pads, tucked towards short fine leg"," on the pads, glanced straight to short fine leg",Unknown,On the pads,Unknown,Unknown,Normal,Pull,Short Fine Leg,Middled,Legal,Not Out,Normal ,Normal Fielding,Normal Fielding,Normal Fielding,Nothing,Nothing
5,4,Tom Curran ,Mohammad Hafeez ,Single,1,"Short, pulled from outside off, single to deep square leg","horter from Curran, Hafeez pulls it along the carpet to deep mid-wicket",Short (>9 m),Outside Off,Unknown,Unknown,Normal,Pull,Deep Square leg,Middled,Legal,Not Out,Normal ,Normal Fielding,Normal Fielding,Normal Fielding,Nothing,Nothing
5,5,Tom Curran ,Haider Ali ,Dot,0,"Bangs in the bumper wide of off stump, Haider bottom-edges a pull through to the keeper"," bangs it short outside off and it doesn't arrive at all, Haider Ali was through the pull a few days early and ends up getting a bottom edge which rolls through to the keeper",Short (>9 m),Off Stump,Unknown,Unknown,Normal,Pull,Wicket Keeper,Bottom Edge,Legal,Not Out,Normal ,Normal Fielding,Normal Fielding,Normal Fielding,Nothing,Nothing
5,6,Tom Curran ,Haider Ali ,Four,4,Still a flak in that! Mr Whippy wrists from Haider as he ices a Curran half-volley through midwicket to the fence! Decent over nevertheless," magnificent. Full and fired at Haider Ali's pads, who shows no mercy and whacks it with grace and flair over mid-wicket. This lad is already looking impressive. Bad finish to the over from Curran",Half-volley(<5 m),Unknown,Unknown,Unknown,Normal,Lofted Drive,Mid Wicket,Middled,Legal,Not Out,Normal ,Normal Fielding,Normal Fielding,Normal Fielding,Nothing,Nothing
6,1,Chris Jordan ,Mohammad Hafeez ,Single,1,"Length on the stumps, tucks him up and Hafeez can only jab one to mid-on",nudged gently in front of mid-on,Length (6-9 m),On the stumps,Unknown,Unknown,Normal,Pull,Mid On,Middled,Legal,Not Out,Normal ,Normal Fielding,Normal Fielding,Normal Fielding,Nothing,Nothing
6,2,Chris Jordan ,Haider Ali ,Four,4,"Short outside off, Haider bottom-edges this to fine leg! Makes his own luck with a hack across the line, skitters away past the man on the edge of the ring","ah, well, you do expect that lady luck to go your way sometimes in cricket. Dug in short by Jordan, Haider Ali sets up to pull and in the process, manages an inside edge which misses the stumps and trickles past the man at 45. Jordan throws a wry smile, nothing much you can about these.",Short (>9 m),Outside Off,Unknown,Unknown,Normal,On drive,Fine Leg,Bottom Edge,Legal,Not Out,Normal ,Normal Fielding,Normal Fielding,Normal Fielding,Nothing,Nothing
6,3,Chris Jordan ,Haider Ali ,Four,4,"Rammed through backward square, he's got hold of that! Cramped for room but those hands came through so quickly, sends a rasping pull to the long boundary","this is imperious! As commanding as it gets. Climbs onto this short delivery zeroed at his tummy, swivels around and muscles it to deep backward square leg",Short (>9 m),Unknown,Unknown,Unknown,Normal,Pull,Square Leg,Middled,Legal,Not Out,Normal ,Normal Fielding,Normal Fielding,Normal Fielding,Nothing,Nothing
6,4,Chris Jordan ,Haider Ali ,Single,1,Shortish and forced away off the back foot,"back of a length outside off, Hafeez packs a punch but can't pierce the gap on the off-side",Short (>9 m),On the stumps,Unknown,Unknown,Normal,Pushes,Mid On,Middled,Legal,Not Out,Normal ,Normal Fielding,Normal Fielding,Normal Fielding,Nothing,Nothing
6,5,Chris Jordan ,Mohammad Hafeez ,Dot,0,"Pitched up, Hafeez is forward and gently taps into the covers","back of a length outside off, Hafeez packs a punch but can't pierce the gap on the off-side",Short (>9 m),Outside Off,Unknown,Unknown,Normal,Taps,Cover,Middled,Legal,Not Out,Normal ,Normal Fielding,Normal Fielding,Normal Fielding,Nothing,Nothing
6,6,Chris Jordan ,Mohammad Hafeez ,Dot,0,"Slower ball, I think, and he's through the shot early, chipped towards extra cover... doesn't quite carry to the England captain, Morgan"," an uppish check drive that nearly went to hand at extra cover. Looked like the slower ball and Hafeez was through the shot early, bounces in front of the fielder",Length (6-9 m),Unknown,Unknown,Unknown,Slower Ball,Clipped,Extra Cover,Middled,Legal,Not Out,Normal ,Normal Fielding,Normal Fielding,Normal Fielding,Nothing,Nothing
7,1,Tom Curran ,Haider Ali ,Single,1,Fullish and driven down the ground coming forwards on off stump,"137kph, fuller length outside off. Haider Ali displays a bottom-handed jab to mid-off",Full length(5-6 m),Outside Off,Unknown,137,Normal,On drive,Mid Off,Middled,Legal,Not Out,Normal ,Normal Fielding,Normal Fielding,Normal Fielding,Nothing,Nothing
7,1,Tom Curran ,Mohammad Hafeez ,Dot,0,"Length, 84mph/136kph and heading leg side as Hafeez swings to leg... there was a sound, umpire Michael Burns says ""not out"", but no wide signalled. Flicked the pad","not a wide? Okay, guess it brushed the pad on the way through to the keeper. Full and jagging back into the right-hander, Hafeez fails to meet with the flick",Length (6-9 m),Leg Side,Unknown,136,Normal,Miss,Wicket Keeper,Miss,Legal,Not Out,Normal ,Normal Fielding,Normal Fielding,Normal Fielding,Nothing,Nothing
7,1,Tom Curran ,Mohammad Hafeez ,Four,4,"Panhandled over midwicket! Fetches a pull in front of deep square, almost goes all the way... first boundary for Hafeez","clubbed over mid-wicket. Hafeez is in form and this is a testament to it. Picks the shortish length early, hangs back and pummels it off the screws in the gap. Couple of bounces and over the ropes",Short (>9 m),Unknown,Unknown,Unknown,Normal,Cut,Deep Square leg,Middled,Legal,Not Out,Normal ,Normal Fielding,Normal Fielding,Normal Fielding,Nothing,Nothing
7,1,Tom Curran ,Mohammad Hafeez ,Single,1,"Length outside off, maybe a slower ball and this is guided to third man","plugs the corridor outside off, Hafeez directs it to third man after unlocking the bat-face",Length (6-9 m),Outside Off,Unknown,Unknown,Slower Ball,Pull,Third Man,Middled,Legal,Not Out,Normal ,Normal Fielding,Normal Fielding,Normal Fielding,Nothing,Nothing
7,1,Tom Curran ,Haider Ali ,Single,1,Angled in on the stumps and nudged for one,turned off the pads to the left of the short fine leg fielder,Length (6-9 m),On the stumps,Unknown,Unknown,Normal,Nudged,Fine Leg,Middled,Legal,Not Out,Normal ,Normal Fielding,Normal Fielding,Normal Fielding,Nothing,Nothing
7,1,Tom Curran ,Mohammad Hafeez ,Dot,0,"Short ball, loopy bouncer through to the keeper as Hafeez ducks it","Curran unleashes a bouncer, Hafeez wisely sits under it",Short (>9 m),Bouncer,Unknown,Unknown,Bouncer,leave,Wicket Keeper,Miss,Legal,Not Out,Normal ,Normal Fielding,Normal Fielding,Normal Fielding,Nothing,Nothing
8,1,Lewis Gregory ,Haider Ali ,Six,6,"Haider tees off straight away! Length ball on the pads, Haider swings gleefully to leg, holds his shape like Tiger aiming for the fairways... All the way over the long boundary at deep midwicket! Yeesh!","hoicked over deep square leg for half-a-dozen. Unreal power. Just loads up his bottom hand, gets under this full ball and dispatches it over the ropes. He's moved to 30 off just 13 balls. Unbelievable hitting",Length (6-9 m),On the pads,Unknown,Unknown,Normal,Swings,Deep Mid Wicket,Middled,Legal,Not Out,Normal ,Normal Fielding,Normal Fielding,Normal Fielding,Nothing,Nothing
8,2,Lewis Gregory ,Haider Ali ,Single,1,"Skidding through outside off, angled behind square","very smart again, uses all the pace and width to steer it away to third man",Length (6-9 m),Outside Off,Unknown,Unknown,Normal,Pull,Third Man,Middled,Legal,Not Out,Normal ,Normal Fielding,Normal Fielding,Normal Fielding,Nothing,Nothing
8,3,Lewis Gregory ,Mohammad Hafeez ,Single,1,"Short and wide, 78mph/126kph and flogged through the infield to deep cover","shorter outside off, slapped to sweeper cover",Short (>9 m),Outside Off,Unknown,126,Slower Ball,Flick,Cover,Middled,Legal,Not Out,Normal ,Normal Fielding,Normal Fielding,Normal Fielding,Nothing,Nothing
8,4,Lewis Gregory ,Haider Ali ,Single,1,"Short of a length, skidding on as Haider pulls along the carpet for one",extricates his big back-lift and smashes the pull to deep mid-wicket,Short (>9 m),Unknown,Unknown,Unknown,Normal,Pull,Deep Mid Wicket,Middled,Legal,Not Out,Normal ,Normal Fielding,Normal Fielding,Normal Fielding,Nothing,Nothing
8,5,Lewis Gregory ,Mohammad Hafeez ,Single,1,"Swung into the leg side and they think about coming for two, Billings fires in a throw... it's then misfielded, but still England manage to keep them to one",Hafeez takes a few steps forward and pushes it to long-on,Unknown,Down the leg side,Unknown,Unknown,Normal,Pushes,Long On,Middled,Legal,Not Out,Normal ,Miss Field,Normal Fielding,Normal Fielding,Nothing,Nothing
8,6,Lewis Gregory ,Haider Ali ,Single,1,Short and down the leg side - called,"Gregory goes for the slower bouncer but slips it down the leg-side. The ump ain't letting him go without a penalty, so he has to rebowl it",Short (>9 m),Down the leg side,Unknown,Unknown,Normal,leave,Wicket Keeper,Miss,Wide Ball,Not Out,Normal ,Normal Fielding,Normal Fielding,Normal Fielding,Nothing,Nothing
8,6,Lewis Gregory ,Haider Ali ,Single,1,"Pitched up, 72mph wide of off stuimp and Haider settles for a slice through backward point for one more", throws his weight back and smears it delicately to third man,Length (6-9 m),Wide on the off side,Unknown,116,Normal,Slice,Backward Point,Middled,Legal,Not Out,Normal ,Normal Fielding,Normal Fielding,Normal Fielding,Nothing,Nothing
9,1,Adil Rashid ,Haider Ali ,Double,2,"Pushes this through quite wide of the stumps, loosener from Rashid and it's cut behind deep point for a couple","slider outside off, Haider Ali gets back and cuts it square past point. Long chase for the sweeper cover fielder and they will nab two comfortably",Length (6-9 m),Outside Off,Unknown,Unknown,Normal,Cut,Deep Point,Middled,Legal,Not Out,Normal ,Normal Fielding,Normal Fielding,Normal Fielding,Nothing,Nothing
9,2,Adil Rashid ,Haider Ali ,Double,2,"Drops short, Haider goes back on his stumps and flicks through backward square leg","googly, drifts onto the pads and Haider Ali tickles it behind square and adds two more to his tally",Short (>9 m),Onto the pads,Unknown,Unknown,Googly,Flick,Backward Square Leg,Middled,Legal,Not Out,Normal ,Normal Fielding,Normal Fielding,Normal Fielding,Nothing,Nothing
9,3,Adil Rashid ,Haider Ali ,Single,1,"Bit of flight, this spins away as Haider reaches out and dabs for one","flighted delivery, some turn for Adil after pitching. Draws Haider Ali forward, who squirts his defence off the outer half and it rolls to point",Flighted,Off Side,Unknown,Unknown,Normal,Cut,Point,Middled,Legal,Not Out,Normal ,Normal Fielding,Normal Fielding,Normal Fielding,Nothing,Nothing
9,4,Adil Rashid ,Mohammad Hafeez ,Four,4,"Flat outside off, cut hard behind point and it looks to be rolling to the boundary marker... until Gregory throws himself full length to pull the ball in! Top work in the deep, I think Still four because his knee was touching the rope (although it requires multiple replays to confirm)"," too short and wide from Rashid, Hafeez pivots deep in his crease and flays it beautifully past point. Gregory sprints across, tries his best but in vain",Short (>9 m),Outside Off,Unknown,Unknown,Normal,On drive,Point,Middled,Legal,Not Out,Normal ,Normal Fielding,Normal Fielding,Normal Fielding,Nothing,Nothing
9,5,Adil Rashid ,Mohammad Hafeez ,Single,1,Tossed up and slapped down the ground to long-on,"gives some air, hammered to long-off",Good length(6-8 m),Unknown,Unknown,Unknown,Normal,Flick,Long On,Middled,Legal,Not Out,Normal ,Normal Fielding,Normal Fielding,Normal Fielding,Nothing,Nothing
9,6,Adil Rashid ,Haider Ali ,Single,1,"Googly, tucked off the stumps through midwicket"," bowls the wrong 'un, Haider Ali nurdles it through mid-wicket",Good length(6-8 m),Off Stump,Unknown,Unknown,Googly,Pull,Mid Wicket,Middled,Legal,Not Out,Normal ,Normal Fielding,Normal Fielding,Normal Fielding,Nothing,Nothing
10,1,Lewis Gregory ,Haider Ali ,Dot,0,Driven hard but he picks out mid-off,"back of the hand slower ball, overpitched outside off. Haider Ali bashes it straight to extra cover",Short (>9 m),Outside Off,Unknown,Unknown,Slower Ball,Pull,Mid off,Middled,Legal,Not Out,Normal ,Normal Fielding,Normal Fielding,Normal Fielding,Nothing,Nothing
10,2,Lewis Gregory ,Haider Ali ,Four,4,"Clubbed leg side, the long part of the ground again... clears the leaping Sam Billings at deep midwicket! Did Billings misjudge it? He seemed a long way in, the ball went yards over his head in the end, bouncing away for four","oh dear! Sam Billing at deep mid-wicket has misjudged this terribly. Haider Ali miscued the slog, skied it towards Billings, who charged forward too early only to find out that the ball is soaring over his head. Leapt back but couldn't even get a hand to it. Haider Ali riding his luck!",Length (6-9 m),Down the leg side,Unknown,Unknown,Normal,On drive,Mid Wicket,Middled,Legal,Not Out,Normal ,Miss Field,Normal Fielding,Normal Fielding,Nothing,Nothing
10,3,Lewis Gregory ,Haider Ali ,Single,1,Shortish and angled to third man playing back,Haider Ali brings up the 50-run stand with a deft steer to third man,Short (>9 m),Unknown,Unknown,Unknown,Normal,Pull,Third Man,Middled,Legal,Not Out,Normal ,Normal Fielding,Normal Fielding,Normal Fielding,Batsmans Celebration,Nothing
