Over #,Ball #,Bowler_Name+Cricinfo_Link,Batsman_Name+Cricinfo_Link,Outcome,Total Runs ,Comment_CricInfo,Comment_CricBuzz,Delivery Length,Delivery Line,Bowling Side,Delivery Speed,Delivery Type,Shot Type ,Shot Field Position,Hit Type,Ball Type,Out_type,Umpire Actions,Field Activity 1 ,Field Activity 2 ,Field Activity 3 ,Other Actions 1,Other Actions 2
10,4,Lewis Gregory ,Mohammad Hafeez ,Double,2,"Short and swung away behind square on the leg side, Banton does well to cut it off but they hare back for two"," cutting back in, short-arm pulled behind square on the leg-side, Hafeez swindles two",Short (>9 m),On the stumps,Unknown,Unknown,Normal,Swung,Leg Side,Middled,Legal,Not Out,Normal ,Normal Fielding,Normal Fielding,Normal Fielding,Nothing,Nothing
10,5,Lewis Gregory ,Mohammad Hafeez ,Dot,0,"Bouncer, 80mph/129kph and climbing through wide of the stumps... Hafeez wanted the extra there","skiddy short delivery outside off, Hafeez looks to ramp it over the keeper, gets undone by the zip and extra bounce",Short (>9 m),Wide on the off side,Unknown,129,Bouncer,Pull,Wicket Keeper,Miss,Legal,Not Out,Normal ,Normal Fielding,Normal Fielding,Normal Fielding,Nothing,Nothing
10,6,Lewis Gregory ,Mohammad Hafeez ,Dot,0,"Good slower ball to finish, deceives him as it spins through under the bat, not far from shaving off stump","dot to finish the over. Robs off all the pace on this length delivery, Hafeez was advancing down the track and swung his bat at it, but it stoops low under his bat",Length (6-9 m),Down the leg side,Unknown,Unknown,Slower Ball,Pull,Wicket Keeper,Inside Edge,Legal,Not Out,Normal ,Normal Fielding,Normal Fielding,Normal Fielding,Nothing,Nothing
11,1,Adil Rashid ,Haider Ali ,Double,2,"Ooh err, loses his line here, wide of the cut strip and spinning further past Bairstow for a couple"," lots of turn for Rashid on this leg-break, however, it starts from way outside off. Bairstow fumbles and they will steal a bye along with the wide",Length (6-9 m),Wide on the off side,Unknown,Unknown,Leg Break,Pull,Unknown,Middled,Wide Ball,Not Out,Normal ,Normal Fielding,Normal Fielding,Normal Fielding,Nothing,Nothing
11,1,Adil Rashid ,Mohammad Hafeez ,Dot,0,"Appeal for lbw, big heave across the line from Hafeez... spinning too much, maybe? Michael Burns not interested and England don't review","appeal for lbw but the ump walks away without any interest. Hafeez sank low to sweep, couldn't connect the shot and was struck on the back thigh. Impact outside off? Maybe..",Length (6-9 m),On the pads,Unknown,Unknown,Leg Break,Miss,Bowler,Miss,Legal,Not Out,Normal ,Normal Fielding,Normal Fielding,Normal Fielding,Appeal by Bowler,Nothing
11,2,Adil Rashid ,Mohammad Hafeez ,Single,1,Clipped down the ground to long-on,uses his feet and drills it to long-on,Length (6-9 m),Unknown,Unknown,Unknown,Normal,Clipped,Long On,Middled,Legal,Not Out,Normal ,Normal Fielding,Normal Fielding,Normal Fielding,Nothing,Nothing
11,3,Adil Rashid ,Haider Ali ,Single,1,Tossed up and punched back past the bowler again,picked away to long-on,Length (6-9 m),Unknown,Unknown,Unknown,Normal,Picked Away,Long On,Middled,Legal,Not Out,Normal ,Normal Fielding,Normal Fielding,Normal Fielding,Nothing,Nothing
11,4,Adil Rashid ,Mohammad Hafeez ,Six,6,"Floated up full, Hafeez picks the Bosie and slog-sweeps it over deep midwicket for six","Hafeez breaks the shackles. Couldn't lay bat on the slog sweep earlier in the over, this time read the leg-break and smoked it into the vacant deep mid-wicket stands",Full length(5-6 m),In the stumps,Unknown,Unknown,Leg Break,Sweep,Mid Wicket,Middled,Legal,Not Out,Normal ,Normal Fielding,Normal Fielding,Normal Fielding,Nothing,Nothing
11,5,Adil Rashid ,Mohammad Hafeez ,Six,6,"Launched again! Skips out to this one, doesn't allow the ball to turn away from him, banged high over deep square leg... he's lost the ball this time!"," two in a row! He's turning the tide. Very similar shot, Rashid helped his cause by floating it further up above his eyeline, Hafeez with a bent knee dismisses it over deep mid-wicket once again",Length (6-9 m),In the stumps,Unknown,Unknown,Leg Break,Square Drive,Square Leg,Middled,Legal,Not Out,Normal ,Normal Fielding,Normal Fielding,Normal Fielding,Nothing,Nothing
11,6,Adil Rashid ,Mohammad Hafeez ,Dot,0,"A good one, pushed through and spinning away, low past Hafeez's cross-batted swipe through to the keeper","better end to the over from Rashid. Flatter and gets it to fizz off the deck outside off, no bounce whatsoever and despite Hafeez crouching low, he's unable to meet it with his bat",Flatter,Outside Off,Unknown,Unknown,Outswinger,Miss,Wicket Keeper,Miss,Legal,Not Out,Normal ,Normal Fielding,Normal Fielding,Normal Fielding,Nothing,Nothing
12,1,Lewis Gregory ,Haider Ali ,Single,1,"Short ball on off, Haider pulls it through square leg for one","128kph, juicy short delivery into the body, Haider Ali rotates 360 degrees in his crease after connecting the pull, sends it to deep square leg",Short (>9 m),On Off,Unknown,128,Normal,Pull,Deep Square leg,Middled,Legal,Not Out,Normal ,Normal Fielding,Normal Fielding,Normal Fielding,Nothing,Nothing
12,2,Lewis Gregory ,Mohammad Hafeez ,Dot,0,"Sashays down, looking to boom this back down the ground... misses a cutter flung wide of the stumps","swing and a miss! Fuller length, Gregory went wider of off. Hafeez doesn't move his feet an inch and wants to reach, no luck.",Full length(5-6 m),Wide on the off side,Unknown,Unknown,Normal,Cut,Wicket Keeper,Miss,Legal,Not Out,Normal ,Normal Fielding,Normal Fielding,Normal Fielding,Nothing,Nothing
12,3,Lewis Gregory ,Mohammad Hafeez ,Single,1,Shortish and Hafeez bottom-edges this through backward square leg,"drags this off inside half, dribbles away to fine leg",Short (>9 m),Unknown,Unknown,Unknown,Normal,Pull,Square Leg,Inside Edge,Legal,Not Out,Normal ,Normal Fielding,Normal Fielding,Normal Fielding,Nothing,Nothing
12,4,Lewis Gregory ,Haider Ali ,Double,2,"Slower ball on the stumps, Haider watches it closely and clips uppishly through midwicket into a gap"," full and on middle, Haider Ali bends forward and flicks it to the right of long-on. Quickly turns back and gets a double",Full length(5-6 m),On the stumps,Unknown,Unknown,Slower Ball,Clipped,Mid Wicket,Middled,Legal,Not Out,Normal ,Normal Fielding,Normal Fielding,Normal Fielding,Nothing,Nothing
12,5,Lewis Gregory ,Haider Ali ,Dot,0,"Back of a length, misses out looking to swipe off his hip","slower delivery on leg, Haider Ali went gung-ho.. it kisses the thigh and Bairstow gathers it on the bounce moving to his left",Short (>9 m),On Leg,Unknown,Unknown,Slower Ball,Pull,Bowler,Miss,Legal,Not Out,Normal ,Normal Fielding,Normal Fielding,Normal Fielding,Nothing,Nothing
12,6,Lewis Gregory ,Haider Ali ,Four,4,"Cracked in front of square on the pull, finds the boundary, fifty on debut for Haider Ali! Played beautifully on his first outing, raises the bat to his team-mates. First man to do so for Pakistan in T20Is, living up to his billing as a bright young thing","maiden T20I fifty for Haider Ali. Take a bow, young man! Waves his bat to the dug-out and his skipper is thrilled as he appreciates the knock. Pakistan have unearthed a new talent, watch out for this 19-year old. Dispatches this short delivery through mid-wicket and finds the fence. Reaches the milestone with a boundary",Short (>9 m),On the stumps,Unknown,Unknown,Normal,Pull,Square,Middled,Legal,Not Out,Normal ,Normal Fielding,Normal Fielding,Normal Fielding,Batsmans Celebration,Nothing
13,1,Tom Curran ,Mohammad Hafeez ,Single,1,Short of a length outside off and he dabs one to third man,"shorter outside off, glided away to third man",Short (>9 m),Outside Off,Unknown,Unknown,Normal,Glided Away,Third Man,Middled,Legal,Not Out,Normal ,Normal Fielding,Normal Fielding,Normal Fielding,Nothing,Nothing
13,2,Tom Curran ,Haider Ali ,Dot,0,"Slower ball from Curran, beats Haider's attempted moosing over the leg side, big ole swing and a miss","off-paced delivery outside off, Haider Ali wields his bat but can't connect",Length (6-9 m),Outside Off,Unknown,Unknown,Slower Ball,Pull,Wicket Keeper,Miss,Legal,Not Out,Normal ,Normal Fielding,Normal Fielding,Normal Fielding,Nothing,Nothing
13,3,Tom Curran ,Haider Ali ,Single,1,Fired full on off and punched for one through the covers,drives this low full toss to extra cover,Full length(5-6 m),On Off,Unknown,Unknown,Normal,Punches,Cover,Middled,Legal,Not Out,Normal ,Normal Fielding,Normal Fielding,Normal Fielding,Nothing,Nothing
13,4,Tom Curran ,Mohammad Hafeez ,Six,6,"Hafeez doing sixy bits again! Short and wide of off, Curran is trying to stop him hitting there... but no such luck as Hafeez goes back and across and fetches it over deep midwicket once again!",third six for Hafeez! Fetches this short delivery from outside off and mows it over cow corner. He's making up for the slow start,Short (>9 m),Outside Off,Unknown,Unknown,Normal,On drive,Mid Wicket,Middled,Legal,Not Out,Normal ,Normal Fielding,Normal Fielding,Normal Fielding,Nothing,Nothing
13,5,Tom Curran ,Mohammad Hafeez ,Single,1,"Pace on bouncer, 80mph/129kph wide of the stumps and he swats it through the leg side again",slogs this away to deep mid-wicket,Short (>9 m),Wide on the off side,Unknown,129,Bouncer,Swats,Leg Side,Middled,Legal,Not Out,Normal ,Normal Fielding,Normal Fielding,Normal Fielding,Nothing,Nothing
13,6,Tom Curran ,Haider Ali ,Dot,0,Flung full and wide and Haider can't lay bat on this,"yorker outside off, Haider Ali thought it would be called a wide and left. But it was well inside the tramlines",Yorker (0-2 m),Outside Off,Unknown,Unknown,Normal,leave,Wicket Keeper,Miss,Legal,Not Out,Normal ,Normal Fielding,Normal Fielding,Normal Fielding,Nothing,Nothing
14,1,Adil Rashid ,Mohammad Hafeez ,Dot,0,"Tossed up and skidding into the pads, Hafeez swinging for the fences but fails to connect","advances looking to slog, but can't quite get to the pitch. Ends up wearing it on the pad",Unknown,Into the Pads,Unknown,Unknown,Normal,Swings,Bowler,Miss,Legal,Not Out,Normal ,Normal Fielding,Normal Fielding,Normal Fielding,Nothing,Nothing
14,2,Adil Rashid ,Mohammad Hafeez ,Single,1,Fires this flat and quick down the leg side,drifting down leg from Rashid,Length (6-9 m),Down the leg side,Unknown,Unknown,Normal,leave,Wicket Keeper,Miss,Wide Ball,Not Out,Normal ,Normal Fielding,Normal Fielding,Normal Fielding,Nothing,Nothing
14,2,Adil Rashid ,Mohammad Hafeez ,Six,6,"Looks to do him in the flight, Hafeez on the charge again... Nailed straight! Six more for the Professor, who's giving another tutorial tonight. Pinged over long-on!","this time he gets right to the pitch of it and pumps it down the ground. The shot was made with his footwork, and the hands just carried it out. He's dominating the battle with Rashid",Length (6-9 m),On the stumps,Unknown,Unknown,Normal,Straight drive,Long On,Middled,Legal,Not Out,Normal ,Normal Fielding,Normal Fielding,Normal Fielding,Nothing,Nothing
14,3,Adil Rashid ,Mohammad Hafeez ,Double,2,"Flighted, Hafeez goes for the reverse-swipe over cover, ""catch that!"" yelps Bairstow... but doesn't carry","drags a reverse sweep on this one from well down leg, over point",Length (6-9 m),Flighthed,Unknown,Unknown,Normal,Reverse Sweep,Cover,Middled,Legal,Not Out,Normal ,Normal Fielding,Normal Fielding,Normal Fielding,Nothing,Nothing
14,4,Adil Rashid ,Mohammad Hafeez ,Dot,0,"Floats this up full down the leg side, spins through past the stumps as he attempts another slog-sweep","drifting down leg, and spinning so much so that it beats the sweep, and nearly has Hafeez bowled round his legs",Length (6-9 m),Down the leg side,Unknown,Unknown,Normal,Sweep,Wicket Keeper,Miss,Legal,Not Out,Normal ,Normal Fielding,Normal Fielding,Normal Fielding,Nothing,Nothing
14,5,Adil Rashid ,Mohammad Hafeez ,Four,4,"Hoicked over midwicket on the sweep, this is going to skip away between two fielders set back leg side... Half-century for Hafeez, fourth in his last five T20I innings for Pakistan"," another sweep .. and Hafeez's earned himself a fifty and another series. Big stride, right at the pitch of this and nailing this behind square. You know how he celebrates -- holding the meat of his bat and showing the back of it to his dressing room",Length (6-9 m),On the stumps,Unknown,Unknown,Normal,Sweep,Behind Square,Middled,Legal,Not Out,Normal ,Normal Fielding,Normal Fielding,Normal Fielding,Nothing,Nothing
14,6,Adil Rashid ,Mohammad Hafeez ,Dot,0,Pushed through and he can't connect playing back,"quicker skiddier one, straighteing off a length onto the pads. Hafeez does his best to try and whip, but no, it's too quick",Length (6-9 m),On the pads,Unknown,Unknown,Normal,Pull,Wicket Keeper,Miss,Legal,Not Out,Normal ,Normal Fielding,Normal Fielding,Normal Fielding,Nothing,Nothing
15,1,Chris Jordan ,Haider Ali ,Single,1,"Full on the stumps, clipped through midwicket",middle-lined yorker. Haider's already deep in his crease to get decent bat under this and flick away through mid-wicket,Full length(5-6 m),On the stumps,Unknown,Unknown,Normal,Clipped,Mid Wicket,Middled,Legal,Not Out,Normal ,Normal Fielding,Normal Fielding,Normal Fielding,Nothing,Nothing
15,2,Chris Jordan ,Mohammad Hafeez ,Single,1,"Full and wide, 84mph/135kph and dragged through the leg side, century stand up between these two","135kph, wide yorker now. Hafeez looks to cover drive, but will only drag off the inside half into mid-wicket. It's a 100-run stand -- 63 balls | 50 runs each",Full length(5-6 m),Wide,Unknown,135,Normal,Pull,Leg Side,Middled,Legal,Not Out,Normal ,Normal Fielding,Normal Fielding,Normal Fielding,Nothing,Nothing
15,3,Chris Jordan ,Haider Ali ,Out,0,"Bowled full pint! Off stump is flattened by a fizzing yorker, and Haider's fun on debut is over! Jordan hits the target with one that tails back in at pace with Haider looking to clear the front leg... Still, he's announced himself to the world in fine style, has Haider Ali","Full, reversing back in, 140kph. Surely a 19-year-old debutant - even as good as Haider Ali's been - isn't meant to keep these out. He compulsively stands with a very opened up stance, clearing out his front leg and looking to hoick a drive down the ground. But no, too quick, dipping under and uprooting off.",Full length(5-6 m),In the stumps,Unknown,140,Reverse Swing,Miss,Wicket,Bowled ,Legal,Bowled,Given Out,Normal Fielding,Normal Fielding,Normal Fielding,Bowlers Celebration,Nothing
15,4,Chris Jordan ,Shadab Khan ,Single,1,"Fired in full straight again, squeezed out behind point... England review for lbw, but that's hit the middle of the bat! Quickly turned down by Alex Wharf, the TV umpire, and England lose one of their two reviews","England review an LBW: 144kph, another perfect in-reversing yorker. And it's come flush off the middle of Khan's sqeezed down bat. BANG OFF THE MIDDLE, squirting down to third man",Yorker (0-2 m),On the pads,Unknown,Unknown,Reverse Swing,Forward defence,Bowler,Middled,Legal,Not Out,Given Not Out,Normal Fielding,Normal Fielding,Normal Fielding,Appeal by Bowler,Nothing
15,5,Chris Jordan ,Mohammad Hafeez ,Dot,0,Speared wide of the stumps at 86mph/138kph and Hafeez can't lay bat on it,"wide outside off. Hafeez's trying to be a little too cute, premeditating a reverse paddle and missing all ends up",Length (6-9 m),Outside Off,Unknown,138,Normal,Cut,Wicket Keeper,Miss,Legal,Not Out,Normal ,Normal Fielding,Normal Fielding,Normal Fielding,Nothing,Nothing
15,6,Chris Jordan ,Mohammad Hafeez ,Single,1,"Full toss, 82mph/132kph and mistimed into the midwicket area... was it above waist height? Not deemed so by the on-field umpires, but looked close to me"," high full toss. Almost at the waist .. and Hafeez's taken by surprise, hurrying into his heave and skewing off the top-edge that balloons over mid-on",Full Toss (<0 m),On the stumps,Unknown,132,Normal,Pull,Mid on,Top Edge,Legal,Not Out,Normal ,Normal Fielding,Normal Fielding,Normal Fielding,Nothing,Nothing
16,1,Lewis Gregory ,Mohammad Hafeez ,Double,2,"Another full toss, swung behind square on the leg side, Rashid has to run around","another miscued heave, behind square this time",Full Toss (<0 m),On the stumps,Unknown,Unknown,Normal,Swings,Behind Square,Middled,Legal,Not Out,Normal ,Normal Fielding,Normal Fielding,Normal Fielding,Nothing,Nothing
16,2,Lewis Gregory ,Mohammad Hafeez ,Double,2,"That's a high full toss, flung raggedly down the leg side, YJB does well to prevent it running for four"," 131kph, down leg, gloved away further. And well, a free-hit's coming",Full Toss (<0 m),Unknown,Unknown,131,Normal,Clipped,Leg Side,Middled,No ball,Not Out,Normal ,Normal Fielding,Normal Fielding,Normal Fielding,Nothing,Nothing
16,2,Lewis Gregory ,Shadab Khan ,Single,1,"Slower ball, full outside off and Shadab slogs without timing to long-on"," 120kph, full, and despite Shadab staying crouched and deep in the crease, he doesn't manage to get under this neatly, dragging away to long-on",Full length(5-6 m),Outside Off,Unknown,120,Normal,Pull,Long On,Middled,Legal,Not Out,Normal ,Normal Fielding,Normal Fielding,Normal Fielding,Nothing,Nothing
16,3,Lewis Gregory ,Mohammad Hafeez ,Four,4,"Just clears mid-off, tonking the slower ball down the ground for a welcome boundary!","slower off-cutter. Hafeez picks it up, backing away, stepping out and slicing it straight back down the ground, splitting long-off and on in the process",Length (6-9 m),Outside Off,Unknown,Unknown,Slower Ball,Slice,Long Off,Middled,Legal,Not Out,Normal ,Normal Fielding,Normal Fielding,Normal Fielding,Nothing,Nothing
16,4,Lewis Gregory ,Mohammad Hafeez ,Single,1,"Short ball, pulled behind square"," bouncer .. hurries Hafeez into a top-edged hook, fine leg",Short (>9 m),Unknown,Unknown,Unknown,Bouncer,Pull,Behind Square,Top Edge,Legal,Not Out,Normal ,Normal Fielding,Normal Fielding,Normal Fielding,Nothing,Nothing
16,5,Lewis Gregory ,Shadab Khan ,Dot,0,"Back of a length again, maybe pace off and Shadab misses with a back-foot carve","118kph, slower bouncer. Khan tries making room, and is already through his cut before this ball can get to him. Well, there wasn't much room either to be playing it in the first place, but never mind .",Short (>9 m),Wide on the off side,Unknown,118,Slower Ball,Cut,Wicket Keeper,Miss,Legal,Not Out,Normal ,Normal Fielding,Normal Fielding,Normal Fielding,Nothing,Nothing
16,6,Lewis Gregory ,Shadab Khan ,Four,4,"Gets this away over backward point! On his toes and opening up to play this late behind square, gets it through the infield and will pick up four!"," and does what he couldn't off the previous ball. Gregory sticks to the same plan of keeping it short and looking to angle it in. Shadab reads the pace well now, makes room as he did earlier and chops it uppishly into an empty third man",Short (>9 m),Unknown,Unknown,Unknown,Normal,Pull,Third Man,Middled,Legal,Not Out,Normal ,Normal Fielding,Normal Fielding,Normal Fielding,Nothing,Nothing
17,1,Tom Curran ,Mohammad Hafeez ,Six,6,"Heaves a full toss into the stands! Deliverooed for six, a standing wallop as Curran misses his length","full toss. In the arc. Into the park. Yep, Hafeez knows. He picks it up perfectly with a full swing of his hands and Curran's missed yorker ends up into cow corner",Full Toss (<0 m),Into the stumps,Unknown,Unknown,Normal,Swings,Unknown,Middled,Legal,Not Out,Normal ,Normal Fielding,Normal Fielding,Normal Fielding,Nothing,Nothing
17,2,Tom Curran ,Mohammad Hafeez ,Single,1,"Full and quick on off stump, dug out for one","136kph, decent yorker that comes out right on the base of middle. Dug out to mid-off",Yorker (0-2 m),On off stumps,Unknown,136,Normal,Flick,Mid Off,Middled,Legal,Not Out,Normal ,Normal Fielding,Normal Fielding,Normal Fielding,Nothing,Nothing
17,3,Tom Curran ,Shadab Khan ,Single,1,"Full toss, 82mph, this time Shadab can only scoop one back over the bowler's head"," 132kph, and this yorker-to-be is a very low full toss. Khan looks to loft, but toe-ends it loopily over the bowler's head. That's all",Yorker (0-2 m),Wide on the off side,Unknown,132,Normal,Straight drive,Backward Point,Middled,Legal,Not Out,Normal ,Normal Fielding,Normal Fielding,Normal Fielding,Nothing,Nothing
17,4,Tom Curran ,Mohammad Hafeez ,Single,1,"Goes full and wide, jams down for one through gully","wide yorker, a stretched squeeze backward of point",Full length(5-6 m),Wide on the off side,Unknown,Unknown,Normal,Pull,Gully,Middled,Legal,Not Out,Normal ,Normal Fielding,Normal Fielding,Normal Fielding,Nothing,Nothing
17,5,Tom Curran ,Shadab Khan ,Single,1,"Slower ball, Shadab swings like big bad Benny Goodman but only manages a bottom edge into the leg side","111kph, clever mix up -- taking pace off this back of a length delivery. And Shadab's early onto his pull, miscuing off the inside-half into mid-wicket",Short (>9 m),Unknown,Unknown,111,Slower Ball,Pull,Leg Side,Bottom Edge,Legal,Not Out,Normal ,Normal Fielding,Normal Fielding,Normal Fielding,Nothing,Nothing
17,6,Tom Curran ,Mohammad Hafeez ,Single,1,"Length ball, paddled away through square leg from outside off - 11 off the over but could have been worse for Curran after that start","wide full toss. Hafeez knows fine leg is inside the ring, and he wants to sweep it way over him. Nope, he'll drag it to deep square leg instead",Length (6-9 m),Wide,Unknown,Unknown,Normal,Flick,Outside Off,Middled,Legal,Not Out,Normal ,Normal Fielding,Normal Fielding,Normal Fielding,Nothing,Nothing
18,1,Saqib Mahmood,Mohammad Hafeez ,Single,1,"Pitched up and dragged into the leg side, they'll only get one","137kph, drills it straight to cow corner, and despite the huge boundary on the leg-side, Hafeez's timed it to well that he isn't even getting a second",Length (6-9 m),Unknown,Unknown,137,Normal,Dragged,Leg Side,Middled,Legal,Not Out,Normal ,Normal Fielding,Normal Fielding,Normal Fielding,Nothing,Nothing
18,2,Saqib Mahmood,Shadab Khan ,Single,1,"Pitched up and following Shadab as he steps to leg, clipped out to deep midwicket"," 138kph, ful again, spots Shadab clearing out his front leg and making room and follows the yorker into him. The result: an uppish flick, deep mid-wicket",Full length(5-6 m),Down the leg side,Unknown,138,Normal,Flick,Deep Mid Wicket,Middled,Legal,Not Out,Normal ,Normal Fielding,Normal Fielding,Normal Fielding,Nothing,Nothing
18,3,Saqib Mahmood,Mohammad Hafeez ,Double,2,"Hacked over the leg side, between deep midwicket and deep backward square for two"," 137kph, heaves across the line, crouching, mistiming, square leg. Yea, mistimed help here",Full length(5-6 m),On the off Stump,Unknown,137,Normal,Pull,Deep Backward Square,Middled,Legal,Not Out,Normal ,Normal Fielding,Normal Fielding,Normal Fielding,Nothing,Nothing
18,4,Saqib Mahmood,Mohammad Hafeez ,Single,1,"Full on leg stump, not quite in the blockhole but Hafeez can only swing one to deep midwicket","137kph, full again -- he's been dead accurate here has Mahmood. Another flick that's more a chip straight to deep mid-wicket",Full length(5-6 m),On the leg stump,Unknown,137,Normal,Swings,Deep Mid Wicket,Middled,Legal,Not Out,Normal ,Normal Fielding,Normal Fielding,Normal Fielding,Nothing,Nothing
18,5,Saqib Mahmood,Shadab Khan ,Four,4,"Swiped over backward square leg! Shadab gets his second boundary with a funky flip, bottom handing this between two men back on the rope",terrific blow if you're Pakistan. Mahmood cross-seams it on the legs and for a change dishes out a half volley as well. Shadab goes back deeper in mowing this over short fine leg,Half-volley(<5 m),On the leg stump,Unknown,Unknown,Normal,Flick,Backward Square,Middled,Legal,Not Out,Normal ,Normal Fielding,Normal Fielding,Normal Fielding,Nothing,Nothing
18,6,Saqib Mahmood,Shadab Khan ,Double,2,"Full length, 87mph/139kph and he chips this into a gap at wide long-on",", lofts through the line this time, straight-batted, long-on",Full length(5-6 m),Unknown,Unknown,139,Normal,Lofted Drive,Long On,Middled,Legal,Not Out,Normal ,Normal Fielding,Normal Fielding,Normal Fielding,Nothing,Nothing
19,1,Chris Jordan ,Mohammad Hafeez ,Six,6,"Attempted yorker, slightly too full... caressed for six! Jordan only just missed his mark there, but Hafeez took it on the full and whispered it back down the ground, all the way!",just Hafeez things -- non-muscular timing in waiting under this full toss to tonk it downtown,Full Toss (<0 m),On the stumps,Unknown,Unknown,Normal,Pull,Unknown,Middled,Legal,Not Out,Normal ,Normal Fielding,Normal Fielding,Normal Fielding,Nothing,Nothing
19,2,Chris Jordan ,Mohammad Hafeez ,Single,1,"Dropped! Hammered through the off side, Morgan can't quite reel it in... Flings himself to his right at extra cover, got one hand to the ball, couldn't cling on!","carved hard inside-out, and Morgan - the extra cover in the ring - makes a stunning effort, diving one-handed to his right, but not holding on",Unknown,Unknown,Unknown,Unknown,Normal,Flick,Off Side,Inside Edge,Legal,Not Out,Normal ,Drop Catch,Normal Fielding,Normal Fielding,Nothing,Nothing
19,3,Chris Jordan ,Shadab Khan ,Dot,0,"Full outside off, Shadab goes across his stumps and misses with a cheeky ramp","too cute. Shuffles, looks to lap it over the keeper, but Jordan's slower cutter is a liitle too foxy",Full Toss (<0 m),Outside Off,Unknown,Unknown,Cutter,Miss,Wicket Keeper,Miss,Legal,Not Out,Normal ,Normal Fielding,Normal Fielding,Normal Fielding,Nothing,Nothing
