Over #,Ball #,Bowler_Name+Cricinfo_Link,Batsman_Name+Cricinfo_Link,Outcome,Total Runs ,Comment_CricInfo,Comment_CricBuzz,Delivery Length,Delivery Line,Bowling Side,Delivery Speed,Delivery Type,Shot Type ,Shot Field Position,Hit Type,Ball Type,Out_type,Umpire Actions,Field Activity 1 ,Field Activity 2 ,Field Activity 3 ,Other Actions 1,Other Actions 2
19,4,Chris Jordan ,Shadab Khan ,Out,0,"Bunted to mid-off! Jordan gets another, Shadab picking out Curran for a simple catch... didn't quite land the yorker but it does the job, couldn't get under the ball","Caught by Tom Curran!! In-reversing at 141kph. Full. In the blockhole. Shadab tries to slice, but just doesn't get hold. Hence: doesn't keep it down, doesn't get it over. And mid-off's waiting.",Full length(5-6 m),On the stumps,Unknown,141,Reverse Swing,Cut,Mid Off,Middled,Legal,Caught,Given Out,Normal Fielding,Normal Fielding,Normal Fielding,Bowlers Celebration,Nothing
19,5,Chris Jordan ,Imad Wasim ,Double,2,"Dropped! Imad slogs a slower delivery straight up, looks to be a simple catch coming in from long-on, but Curran shells it this time! Into the hands and out again","a sitter dropped. Imad hoicks with no timing whatsover, and Jordan's slower one foxes him further. Anyway, it's a skier at long-on, where Tom Curran is comfortably under this, only to put it down inexplicably",Unknown,Down the leg side,Unknown,Unknown,Normal,Straight drive,Long On,Middled,Legal,Not Out,Normal ,Normal Fielding,Normal Fielding,Normal Fielding,Nothing,Nothing
19,6,Chris Jordan ,Imad Wasim ,Double,2,"Heaved through the leg side, they'll get a couple to Curran at wide long-on this time"," another wristy hoick, another mistime, but safely on the bounce to long-on now",Unknown,Down the leg side,Unknown,Unknown,Normal,Pull,Long On,Middled,Legal,Not Out,Normal ,Normal Fielding,Normal Fielding,Normal Fielding,Nothing,Nothing
20,1,Saqib Mahmood,Mohammad Hafeez ,Single,1,"Pitched up, 84mph/136kph in the slot and pounded down the ground to long-on","136kph, full, on middle, a leg-clearing whip, long-on",Full Toss (<0 m),On middle stump,Unknown,136,Normal,Whipped,Long On,Middled,Legal,Not Out,Normal ,Normal Fielding,Normal Fielding,Normal Fielding,Nothing,Nothing
20,2,Saqib Mahmood,Imad Wasim ,Single,1,"Over the wicket to the lefty, sprayed wide of the tramlines", throws it full and angles away way outside off. Wasim doesn't even bother reaching out,Full length(5-6 m),Outside Off,Over the Wicket,Unknown,Normal,leave,Wicket Keeper,Miss,Wide Ball,Not Out,Normal ,Normal Fielding,Normal Fielding,Normal Fielding,Nothing,Nothing
20,2,Saqib Mahmood,Imad Wasim ,Single,1,"Fired across the bows again, Imad carves a top edge down to third man","132kph, not ideal, but a thick outside edge on the big cut, down to third man, but importantly Hafeez has his strike back",Unknown,Unknown,Unknown,132,Normal,Cut,Third Man,Thick Outside Edge,Legal,Not Out,Normal ,Normal Fielding,Normal Fielding,Normal Fielding,Nothing,Nothing
20,3,Saqib Mahmood,Mohammad Hafeez ,Double,2,"Goes for the blockhole again, Hafeez swats a full toss down the ground and comes back as long-on runs around"," 131kph, miscued hack down the ground into the long boundary, and a second before long-on can get there",Yorker (0-2 m),Into the stumps,Unknown,131,Normal,Swats,Long On,Middled,Legal,Not Out,Normal ,Normal Fielding,Normal Fielding,Normal Fielding,Nothing,Nothing
20,4,Saqib Mahmood,Mohammad Hafeez ,Single,1,"Length outside off, cutter from Mahmood, Hafeez sets himself but can't get it past the man at cover","114kph, length, outside off, cutter. Hafeez slaps hard, but picks extra cover perfectly in the circle",Length (6-9 m),Outside Off,Unknown,114,Cutter,Flick,Cover,Middled,Legal,Not Out,Normal ,Normal Fielding,Normal Fielding,Normal Fielding,Nothing,Nothing
20,5,Saqib Mahmood,Imad Wasim ,Single,1,"Angled across on a length, 84mph/136kph and Imad whacks it along the ground to the cover sweeper","135kph, hard-handed chop at the angling-across width outside off. Alas, no timing, no placement, deep sweeper",Length (6-9 m),Outside Off,Unknown,136,Normal,Pull,Cover Sweeper,Middled,Legal,Not Out,Normal ,Normal Fielding,Normal Fielding,Normal Fielding,Nothing,Nothing
20,6,Saqib Mahmood,Mohammad Hafeez ,Double,2,"Dropped? Think it went straight through Mahmood in his follow through, the ball squeezes past mid-off but long-on comes around... so Hafeez equals his highest T20I score and England will need 191 to win the game and the series"," bashed back, bursting through a taking-cover-Mahmood's palms. Long-on will cut off, 190's Pakistan's ",Length (6-9 m),Into the stumps,Unknown,Unknown,Normal,Straight drive,Long On,Middled,Legal,Not Out,Normal ,Normal Fielding,Normal Fielding,Normal Fielding,Nothing,Nothing
